source_id,title_original,title_english,authors_org,year,publication_date,access_date,last_verified,archive_url,language,source_type,method_type,claim_owner,official_claim_status,independent_validation_status,url_or_doi,original_language_url,translation_reviewer,translation_note,reliability_tier,geo_scope,sector_scope,key_claims,useful_indicators,limitations,date_added,added_by,review_status,placeholder,notes
src-0033,IndiaAI Mission,IndiaAI Mission,Government of India / IndiaAI,2024,missing,2026-06-27,2026-06-27,missing,English,strategy,government_strategy,Government of India,official_program_claim,not_independently_validated,https://indiaai.gov.in/indiaai-mission,https://indiaai.gov.in/indiaai-mission,not_applicable,English source,A,India,compute; data; skills; public-sector,IndiaAI Mission compute datasets skills and responsible AI,india_ai_mission; ai_compute_access,Official program source not delivery evidence,2026-06-27,GPT-5.5 Thinking,reviewed,false,Official IndiaAI source
src-0034,France 2030 strategie nationale pour lintelligence artificielle,France 2030 National Strategy for Artificial Intelligence,Gouvernement francais,2021,missing,2026-06-27,2026-06-27,missing,French,strategy,government_strategy,Government of France,official_program_claim,not_independently_validated,https://www.info.gouv.fr/actualite/france-2030-une-strategie-nationale-pour-lintelligence-artificielle,https://www.info.gouv.fr/actualite/france-2030-une-strategie-nationale-pour-lintelligence-artificielle,agent preliminary human French review recommended,French program details need native review,A,France,frontier-access; compute; talent; diffusion,France 2030 national AI strategy,france_ai_strategy; france2030_ai,Official strategy not target achievement evidence,2026-06-27,GPT-5.5 Thinking,reviewed,false,Official French source candidate
src-0035,Trust attitudes and use of artificial intelligence a global study 2025,Trust attitudes and use of artificial intelligence a global study 2025,KPMG and University of Melbourne,2025,missing,2026-06-27,2026-06-27,missing,English,survey,survey,KPMG and University of Melbourne,not_official_claim,not_applicable,https://kpmg.com/xx/en/our-insights/ai-and-technology/trust-in-artificial-intelligence-global-insights-2025.html,https://kpmg.com/xx/en/our-insights/ai-and-technology/trust-in-artificial-intelligence-global-insights-2025.html,not_applicable,English source,B,global,public-opinion; adaptation; trust,Cross-country survey of trust and acceptance,ai_trust; ai_acceptance,Check sampling before country-level comparisons,2026-06-27,GPT-5.5 Thinking,reviewed,false,Useful for adaptation pillar
src-0036,Generative AI and jobs a refined global index of occupational exposure,Generative AI and jobs a refined global index of occupational exposure,International Labour Organization,2025,missing,2026-06-27,2026-06-27,missing,English,report,think_tank_report,ILO,not_official_claim,not_applicable,https://www.ilo.org/publications/generative-ai-and-jobs-refined-global-index-occupational-exposure,https://www.ilo.org/publications/generative-ai-and-jobs-refined-global-index-occupational-exposure,not_applicable,English source,A,global,labor; adaptation,Occupational exposure to generative AI,genai_occupational_exposure; labor_exposure,Exposure is not displacement,2026-06-27,GPT-5.5 Thinking,reviewed,false,Official ILO publication page
src-0037,OECD Employment Outlook 2025,OECD Employment Outlook 2025,OECD,2025,missing,2026-06-27,2026-06-27,missing,English,report,think_tank_report,OECD,not_official_claim,not_applicable,https://www.oecd.org/en/publications/oecd-employment-outlook-2025.html,https://www.oecd.org/en/publications/oecd-employment-outlook-2025.html,not_applicable,English source,A,OECD,labor; skills; adaptation,Labor-market adjustment and training policy,adult_training; retraining_capacity,Not AI-specific throughout,2026-06-27,GPT-5.5 Thinking,reviewed,false,Official OECD report page
